{
  "formatVersion": { "major": 1, "minor": 0 },
  "timelineId": "timeline.infinite.0",
  "languageVersion": "1.0",
  "compilerVersion": "0.1.0",
  "source": {
    "name": "examples/infinite.gas",
    "mediaType": "text/vnd.gas"
  },
  "playback": { "mode": "infinite" },
  "arrangedBars": 4,
  "globals": {},
  "tracks": [],
  "arrangement": [
    {
      "sectionInstanceId": "section.intro.0",
      "sectionName": "intro",
      "callIndex": 0,
      "start": { "bar": 1 },
      "end": { "bar": 5 }
    }
  ],
  "resources": [],
  "events": []
}
