{
  "formatVersion": { "major": 1, "minor": 0 },
  "timelineId": "timeline.chorus.0",
  "languageVersion": "1.0",
  "compilerVersion": "0.1.0",
  "source": {
    "name": "examples/chorus.gas",
    "mediaType": "text/vnd.gas"
  },
  "playback": { "mode": "finite", "declaredBars": 8 },
  "arrangedBars": 8,
  "musicalContext": {
    "tempo": 104,
    "timeSignature": { "beatsPerBar": 4, "beatUnit": 4 },
    "key": "C minor"
  },
  "globals": {
    "flavor": { "kind": "text", "text": "lofi, intimate, late night" }
  },
  "tracks": [
    {
      "trackId": "track.guitar",
      "name": "guitar",
      "description": "A bright, clean stratocaster playing muted chords",
      "defaults": [
        {
          "defaultId": "default.guitar.motif",
          "action": "motif",
          "value": {
            "kind": "resource",
            "resourceId": "resource.guitar-motif"
          },
          "provenance": {
            "sourceRange": {
              "start": { "line": 8, "character": 0 },
              "end": { "line": 8, "character": 31 }
            }
          }
        }
      ]
    },
    {
      "trackId": "track.drums",
      "name": "drums",
      "description": "Lofi breakbeat, muffled snare",
      "defaults": []
    }
  ],
  "arrangement": [
    {
      "sectionInstanceId": "section.chorus.0",
      "sectionName": "chorus",
      "callIndex": 0,
      "start": { "bar": 1 },
      "end": { "bar": 9 },
      "provenance": {
        "sourceRange": {
          "start": { "line": 20, "character": 0 },
          "end": { "line": 20, "character": 8 }
        }
      }
    }
  ],
  "resources": [
    {
      "resourceId": "resource.guitar-motif",
      "kind": "audio",
      "uri": "assets/gtr_melody.wav",
      "mediaType": "audio/wav",
      "digest": {
        "algorithm": "sha-256",
        "value": "2222222222222222222222222222222222222222222222222222222222222222"
      }
    }
  ],
  "events": [
    {
      "eventId": "event.0000",
      "type": "section",
      "targetId": "section.chorus.0",
      "action": "flavor",
      "position": { "bar": 1 },
      "sequence": 0,
      "scope": "section",
      "sectionInstanceId": "section.chorus.0",
      "value": { "kind": "text", "text": "wide and bright" }
    },
    {
      "eventId": "event.0001",
      "type": "track",
      "targetId": "track.drums",
      "action": "play",
      "position": { "bar": 1 },
      "sequence": 1,
      "scope": "timed",
      "sectionInstanceId": "section.chorus.0"
    },
    {
      "eventId": "event.0002",
      "type": "track",
      "targetId": "track.drums",
      "action": "flavor",
      "position": {
        "bar": 5,
        "beat": {
          "index": 2,
          "offset": { "numerator": 1, "denominator": 3 }
        }
      },
      "sequence": 2,
      "scope": "timed",
      "sectionInstanceId": "section.chorus.0",
      "value": { "kind": "text", "text": "buildup" }
    },
    {
      "eventId": "event.0003",
      "type": "track",
      "targetId": "track.drums",
      "action": "stop",
      "position": { "bar": 8 },
      "sequence": 3,
      "scope": "timed",
      "sectionInstanceId": "section.chorus.0"
    }
  ]
}
